{
  "$schema": "https://json-schema.org/draft/2020-12/schema",
  "title": "caldav-calendar event create input",
  "type": "object",
  "required": ["title", "start", "end"],
  "properties": {
    "calendar": { "type": "string" },
    "title": { "type": "string", "minLength": 1 },
    "start": { "type": "string", "format": "date-time" },
    "end": { "type": "string", "format": "date-time" },
    "timezone": { "type": "string" },
    "location": { "type": "string" },
    "description": { "type": "string" },
    "tags": {
      "type": "array",
      "items": { "type": "string" }
    },
    "recurrence": {
      "type": "object",
      "required": ["frequency"],
      "properties": {
        "frequency": { "type": "string", "enum": ["daily", "weekly", "monthly", "yearly"] },
        "interval": { "type": "integer", "minimum": 1 },
        "count": { "type": "integer", "minimum": 1 },
        "until": { "type": "string", "format": "date-time" },
        "by_day": {
          "type": "array",
          "minItems": 1,
          "items": { "type": "string", "enum": ["MO", "TU", "WE", "TH", "FR", "SA", "SU"] }
        }
      },
      "additionalProperties": false
    },
    "reminders": {
      "type": "array",
      "items": {
        "type": "object",
        "required": ["minutes_before"],
        "properties": {
          "minutes_before": { "type": "integer", "minimum": 0 },
          "description": { "type": "string" },
          "action": { "type": "string", "enum": ["DISPLAY"] }
        },
        "additionalProperties": false
      }
    }
  },
  "additionalProperties": false
}
