{
  "title": "Review updated summer camp materials",
  "start": "2026-05-16T15:00:00",
  "end": "2026-05-16T17:00:00",
  "timezone": "Asia/Shanghai",
  "location": "",
  "description": "Review updated summer camp knowledge points",
  "tags": ["summer-camp", "study"],
  "recurrence": {
    "frequency": "weekly",
    "interval": 1,
    "count": 3,
    "by_day": ["SA"]
  },
  "reminders": [
    {
      "minutes_before": 15,
      "description": "Review updated summer camp materials"
    }
  ]
}
